{
  "schema_version": "rolefox.registry-checkpoint.v1",
  "sequence": 39,
  "created_at": "2026-09-24T02:17:50.410Z",
  "previous": {
    "checkpoint_id": "checkpoint_4b91f7b18a3acb51830bb7dbdfa62841399ed819c20583d4be00a3acf31e13ed",
    "checkpoint_digest": "4b91f7b18a3acb51830bb7dbdfa62841399ed819c20583d4be00a3acf31e13ed",
    "registry_root_digest": "6d76febb2f569ac854d20a244417e06cc0945369f91c16cc2331aaab35877884",
    "record_counts": {
      "gate_records": 31,
      "evidence_manifests": 0,
      "case_evidence_requirements": 0,
      "case_verification": 0,
      "journey_invariant_verification": 0
    }
  },
  "spec_manifest_digest": "f1845377f8d21407cf39c573370ca2d985dac985295d51f28c11e0259bbdba8b",
  "normative_set_digest": "2cebe9d89da2485957b91b3de3e258b2c081a70d32c772cd3011b9519c3bb3f0",
  "catalog_digest": "f0067111f8f5035931619bf9fc86b46de6a9f27c2e4c8f3d48e18623dc698d85",
  "research_protocol_digest": "c2c85eec2ce3bb0b3cc4fd6e1d9555e06a025038d2d6e0bbd30c75eab47346ec",
  "candidate_scope_manifest_digest": "5e14b6cbe45fae70e115bb070060f2b11376da4cea9751daea1c32075665afde",
  "candidate_artifact_digest": "0e5a6b7b3300a780597ceee33e43a72e6421c1bf1fef7769e1935678fa4e60dd",
  "verification_toolchain_digest": "7d7f6d8ecb6c667c950f36e5b66922f9739065971463ce72163571919a2d63a7",
  "gate_registry_digest": "df626e69221ee744bcf67a2b094e1c7e295fcba3d56e8ea59d20326724967108",
  "gate_head_set_digest": "041642d9ce51564fe4db0606fd65de6e94e26bacc68a5f34e4134765ef45c8cb",
  "evidence_manifest_set_digest": "4f53cda18c2baa0c0354bb5f9a3ecbe5ed12ab4d8e11ba873c2f11161202b945",
  "registry_digests": {
    "case_evidence_requirements": null,
    "case_verification": null,
    "journey_invariant_verification": null,
    "lifecycle_state": "NOT_CREATED_PRE_W1"
  },
  "record_counts": {
    "gate_records": 32,
    "evidence_manifests": 0,
    "case_evidence_requirements": 0,
    "case_verification": 0,
    "journey_invariant_verification": 0
  },
  "gate_heads": [
    {
      "gate_id": "PRE_W1_PROBLEM_RULES",
      "scope_id": "pre_w1_problem_and_rules_research",
      "record_id": "gate_e60f32cbc5a3c69b89a9ebbbbfab6ef1dfb38c798e904b361bb29a2180b19688",
      "record_digest": "e60f32cbc5a3c69b89a9ebbbbfab6ef1dfb38c798e904b361bb29a2180b19688",
      "result": "BLOCKED"
    }
  ],
  "evidence_manifest_refs": [],
  "registry_root_digest": "13e43ca30b9e023a184bcbe5f4549689ec361ace84d516d82f00b12a4a076319",
  "signature": {
    "status": "PENDING_TRUSTED_SIGNER",
    "signer": null,
    "signed_payload_digest": "13e43ca30b9e023a184bcbe5f4549689ec361ace84d516d82f00b12a4a076319",
    "signature": null
  },
  "external_anchor": {
    "status": "NOT_CONFIGURED",
    "provider": null,
    "reference": null,
    "anchored_at": null,
    "anchored_payload_digest": "13e43ca30b9e023a184bcbe5f4549689ec361ace84d516d82f00b12a4a076319"
  },
  "checkpoint_id": "checkpoint_327780a73185acdb85d97f8a0f4c8ab7b2dfe82c312b551ad2b593ba38179319",
  "checkpoint_digest": "327780a73185acdb85d97f8a0f4c8ab7b2dfe82c312b551ad2b593ba38179319"
}
