{
  "schema_version": "rolefox.registry-checkpoint.v1",
  "sequence": 1,
  "created_at": "2026-09-11T09:57:04.151Z",
  "previous": null,
  "spec_manifest_digest": "8e64cbf9feb48d6671fcc7b15de839541769b2cc8f40f547a2f28d9fcb362fdf",
  "normative_set_digest": "f6ee0e1d7e3f04ee31da7d538a248fc78907c2bc07f06bcd32c96c886f628742",
  "catalog_digest": "b7b4837a18ab6ba276bfd898d1fa3258d9a1c3db1d9885bc01fe1b47f3cb5140",
  "research_protocol_digest": "172a87db0174ccf2d38739d90f13bfef9119682e99afeec4a994d044a13a1ede",
  "candidate_scope_manifest_digest": "e503dc9334cf38575229e32a7dac6031d127de15518c173ec34d26e26e9593c1",
  "candidate_artifact_digest": "bfcf0b6a7913f4eec287cde2c027528cb517c746de74a9c18a898e0fd976220e",
  "verification_toolchain_digest": "588110ef58d99577c18a8540a75add06dd81714d579a17dc5137d75b3e449301",
  "gate_registry_digest": "ab2360d0835aa103df80f986faeb90771f8fe97bb4033942404dc79d930a3bc5",
  "gate_head_set_digest": "633739b2baa9bebd41fb866a56dd3700b83d1f097f7ecac21fd9ffc60a424429",
  "evidence_manifest_set_digest": "4f53cda18c2baa0c0354bb5f9a3ecbe5ed12ab4d8e11ba873c2f11161202b945",
  "registry_digests": {
    "case_evidence_requirements": null,
    "case_verification": null,
    "journey_invariant_verification": null,
    "lifecycle_state": "NOT_CREATED_PRE_W1"
  },
  "record_counts": {
    "gate_records": 1,
    "evidence_manifests": 0,
    "case_evidence_requirements": 0,
    "case_verification": 0,
    "journey_invariant_verification": 0
  },
  "gate_heads": [
    {
      "gate_id": "PRE_W1_PROBLEM_RULES",
      "scope_id": "pre_w1_problem_and_rules_research",
      "record_id": "gate_1756a8566df668246416244939f53e23d846466ab62949da5036b11032a43b77",
      "record_digest": "1756a8566df668246416244939f53e23d846466ab62949da5036b11032a43b77",
      "result": "BLOCKED"
    }
  ],
  "evidence_manifest_refs": [],
  "registry_root_digest": "1576e69ee2378e5de7442528f36b39f69cc421f306b2d53c779a4d4075b98232",
  "signature": {
    "status": "PENDING_TRUSTED_SIGNER",
    "signer": null,
    "signed_payload_digest": "1576e69ee2378e5de7442528f36b39f69cc421f306b2d53c779a4d4075b98232",
    "signature": null
  },
  "external_anchor": {
    "status": "NOT_CONFIGURED",
    "provider": null,
    "reference": null,
    "anchored_at": null,
    "anchored_payload_digest": "1576e69ee2378e5de7442528f36b39f69cc421f306b2d53c779a4d4075b98232"
  },
  "checkpoint_id": "checkpoint_334009c2aa7a5209247e5e5e16d79bff90e12c78be063831065f64d125f8c8f8",
  "checkpoint_digest": "334009c2aa7a5209247e5e5e16d79bff90e12c78be063831065f64d125f8c8f8"
}
