{
  "schema_version": "rolefox.registry-checkpoint.v1",
  "sequence": 12,
  "created_at": "2026-09-13T05:42:05.339Z",
  "previous": {
    "checkpoint_id": "checkpoint_fac1cf33be3d0fcb16be67bc9a5cd3d73888cdcca7ccf105921d9933f5ac5fdd",
    "checkpoint_digest": "fac1cf33be3d0fcb16be67bc9a5cd3d73888cdcca7ccf105921d9933f5ac5fdd",
    "registry_root_digest": "ca25f082e8fa16040af39a051f2ba128229ebda309d6228c4272af1c3bcddb86",
    "record_counts": {
      "gate_records": 11,
      "evidence_manifests": 0,
      "case_evidence_requirements": 0,
      "case_verification": 0,
      "journey_invariant_verification": 0
    }
  },
  "spec_manifest_digest": "1459ca389f136e063b8a54dc66ccfa586a04ab6c18767fd9facbc2cca162e0cb",
  "normative_set_digest": "58f3aff7bbd23b51f83d9c9cac66ef9cd129a0758286f0075bc67cf0123faafa",
  "catalog_digest": "f0067111f8f5035931619bf9fc86b46de6a9f27c2e4c8f3d48e18623dc698d85",
  "research_protocol_digest": "c2c85eec2ce3bb0b3cc4fd6e1d9555e06a025038d2d6e0bbd30c75eab47346ec",
  "candidate_scope_manifest_digest": "687bf921a70566a62d47b53b7210e1aa2bc6169cc8fdbddbef5a930cc4684540",
  "candidate_artifact_digest": "f027f5507b948d06e135f1d6bb9ffb8e7135e4d4734a9963c0cee79574d84943",
  "verification_toolchain_digest": "f21dfbcb2d3673bc391ec255039bd3e2e29d770047ba7158540faa2210c21f68",
  "gate_registry_digest": "4fa8d779012fd83100fc01dc67a94b295862f3ec9327668f4dcaf6c614823de3",
  "gate_head_set_digest": "9c640dd09e06ce3112b6166ff2463969d33b99ef107ff17b4d5615d6919c7f77",
  "evidence_manifest_set_digest": "4f53cda18c2baa0c0354bb5f9a3ecbe5ed12ab4d8e11ba873c2f11161202b945",
  "registry_digests": {
    "case_evidence_requirements": null,
    "case_verification": null,
    "journey_invariant_verification": null,
    "lifecycle_state": "NOT_CREATED_PRE_W1"
  },
  "record_counts": {
    "gate_records": 12,
    "evidence_manifests": 0,
    "case_evidence_requirements": 0,
    "case_verification": 0,
    "journey_invariant_verification": 0
  },
  "gate_heads": [
    {
      "gate_id": "PRE_W1_PROBLEM_RULES",
      "scope_id": "pre_w1_problem_and_rules_research",
      "record_id": "gate_f9b5736f1c97e3aeccd9b321bf2dcb1ee049d47cbe347f0dbe12f439eb9b4601",
      "record_digest": "f9b5736f1c97e3aeccd9b321bf2dcb1ee049d47cbe347f0dbe12f439eb9b4601",
      "result": "BLOCKED"
    }
  ],
  "evidence_manifest_refs": [],
  "registry_root_digest": "a5e0e8cabbdf56f5b9ec76080bf83ce32e3a912c5c7eb9fdd4d7ad73663aff9e",
  "signature": {
    "status": "PENDING_TRUSTED_SIGNER",
    "signer": null,
    "signed_payload_digest": "a5e0e8cabbdf56f5b9ec76080bf83ce32e3a912c5c7eb9fdd4d7ad73663aff9e",
    "signature": null
  },
  "external_anchor": {
    "status": "NOT_CONFIGURED",
    "provider": null,
    "reference": null,
    "anchored_at": null,
    "anchored_payload_digest": "a5e0e8cabbdf56f5b9ec76080bf83ce32e3a912c5c7eb9fdd4d7ad73663aff9e"
  },
  "checkpoint_id": "checkpoint_e42a644760f014c7f9e8bb0b89af61106db79af7c3ae4b6b91ecb2a4b191bb49",
  "checkpoint_digest": "e42a644760f014c7f9e8bb0b89af61106db79af7c3ae4b6b91ecb2a4b191bb49"
}
