{
  "schema_version": "rolefox.registry-checkpoint.v1",
  "sequence": 6,
  "created_at": "2026-09-11T13:57:06.524Z",
  "previous": {
    "checkpoint_id": "checkpoint_63f27183c59b7e2fe395e2b548c38b4b6dd38499d10984065f8214afef063cf4",
    "checkpoint_digest": "63f27183c59b7e2fe395e2b548c38b4b6dd38499d10984065f8214afef063cf4",
    "registry_root_digest": "e34d6b9632b5df98d35860a55b186d8f917c599d5fe02438f4dbc6c8f1baf881",
    "record_counts": {
      "gate_records": 5,
      "evidence_manifests": 0,
      "case_evidence_requirements": 0,
      "case_verification": 0,
      "journey_invariant_verification": 0
    }
  },
  "spec_manifest_digest": "a872729bd9676ab9e50f90f4aa848e37c8c375568c518b5cfd53ee59108a1fb0",
  "normative_set_digest": "19a3fc2454bff24b61a5b65f53e1be0184dad32f3f7d3c318ee022d2b2f0a26c",
  "catalog_digest": "43b2b7e3cdf6420a03c15918a7a202004a9702dc8a3afb8bbf6ff0564a3b6d60",
  "research_protocol_digest": "3f7d5de732931e9a8eaa19dfacafaed426604e054fc3ec402be778bfdd9baa9e",
  "candidate_scope_manifest_digest": "fc8abf86eb0b8663774fd472fa62ef427f216f989a830f810bbc2851a83b70fb",
  "candidate_artifact_digest": "8681fc6ea10ba3cd2bef77ec4d83c5a4e3414cf2e1f275077555d573792a10e8",
  "verification_toolchain_digest": "6074e1d863a6ab5ddf9c4e326456dd3e20af30d71c4f62b36847ccb51afb03d9",
  "gate_registry_digest": "5c20d038456a4145bc29a8e1e498142f0fb11a133fa820d867dac5efdb11beb2",
  "gate_head_set_digest": "bffb35ebc5c21088f05e9a834b769ae9fe1dbcbf7f78b39838bf2c610e24a87c",
  "evidence_manifest_set_digest": "4f53cda18c2baa0c0354bb5f9a3ecbe5ed12ab4d8e11ba873c2f11161202b945",
  "registry_digests": {
    "case_evidence_requirements": null,
    "case_verification": null,
    "journey_invariant_verification": null,
    "lifecycle_state": "NOT_CREATED_PRE_W1"
  },
  "record_counts": {
    "gate_records": 6,
    "evidence_manifests": 0,
    "case_evidence_requirements": 0,
    "case_verification": 0,
    "journey_invariant_verification": 0
  },
  "gate_heads": [
    {
      "gate_id": "PRE_W1_PROBLEM_RULES",
      "scope_id": "pre_w1_problem_and_rules_research",
      "record_id": "gate_fcbc66720aae0f06f67b1a432fb57c080a36c16b2f36cad5268d677f3707af9c",
      "record_digest": "fcbc66720aae0f06f67b1a432fb57c080a36c16b2f36cad5268d677f3707af9c",
      "result": "BLOCKED"
    }
  ],
  "evidence_manifest_refs": [],
  "registry_root_digest": "b6864b012d94545c7a4af5c5c106309cdb087d8d99a653bf415346b244807a57",
  "signature": {
    "status": "PENDING_TRUSTED_SIGNER",
    "signer": null,
    "signed_payload_digest": "b6864b012d94545c7a4af5c5c106309cdb087d8d99a653bf415346b244807a57",
    "signature": null
  },
  "external_anchor": {
    "status": "NOT_CONFIGURED",
    "provider": null,
    "reference": null,
    "anchored_at": null,
    "anchored_payload_digest": "b6864b012d94545c7a4af5c5c106309cdb087d8d99a653bf415346b244807a57"
  },
  "checkpoint_id": "checkpoint_ac519a4e9ce320c0742aa437c8b4894492e7d451633bc10f57822a8dd2d53598",
  "checkpoint_digest": "ac519a4e9ce320c0742aa437c8b4894492e7d451633bc10f57822a8dd2d53598"
}
